{
  "apiVersion": "launchroom.vantezzen.io/v1",
  "kind": "ClientCertificate",
  "serverId": "srv_01J9Z8X7W6V5T4S3R2Q1P0N9MK",
  "certificate": "MIIB/DCCAaKgAwIBAgIQEjRWeJCrze8SNFZ4kKvN7zAKBggqhkjOPQQDAjBKMRMwEQYDVQQKDApsYXVuY2hyb29tMRQwEgYDVQQLDAtpbnNfZXhhbXBsZTEdMBsGA1UEAwwUbGF1bmNocm9vbSBzZXJ2ZXIgQ0EwHhcNMjYxMDIwMDAwNjM5WhcNMjYxMDI3MDAwNjM5WjA+MRMwEQYDVQQKDApsYXVuY2hyb29tMScwJQYDVQQDDB5zcnZfMDFKOVo4WDdXNlY1VDRTM1IyUTFQME45TUswWTATBgcqhkjOPQIBBggqhkjOPQMBBwNCAAT2ByG58kCFJqurfhPI0QJWZvElTxryZlQXANKLuguUCGth+y+iS997KFb8nuxaoPB49+7Ngu4g9Ayc0F3Cj5n3o3YwdDAMBgNVHRMBAf8EAjAAMA4GA1UdDwEB/wQEAwIHgDATBgNVHSUEDDAKBggrBgEFBQcDAjA/BgNVHREEODA2hjR1cm46bGF1bmNocm9vbTpzZXJ2ZXI6c3J2XzAxSjlaOFg3VzZWNVQ0UzNSMlExUDBOOU1LMAoGCCqGSM49BAMCA0gAMEUCIHubfXMTC4vUR1E5tWZFKNHbADteN3bsBQCUI923EwBtAiEAzqAI/WG7tXebJxWP14RxJx/AiWxNU2znZm3Bnx2lxPw=",
  "caCertificates": [
    "MIIB3DCCAYGgAwIBAgIUXsk3+YdpUl96zO/89V/2JeEXikswCgYIKoZIzj0EAwIwSjETMBEGA1UECgwKbGF1bmNocm9vbTEUMBIGA1UECwwLaW5zX2V4YW1wbGUxHTAbBgNVBAMMFGxhdW5jaHJvb20gc2VydmVyIENBMB4XDTI2MTAyMDAwMDYzOVoXDTM2MTAxNzAwMDYzOVowSjETMBEGA1UECgwKbGF1bmNocm9vbTEUMBIGA1UECwwLaW5zX2V4YW1wbGUxHTAbBgNVBAMMFGxhdW5jaHJvb20gc2VydmVyIENBMFkwEwYHKoZIzj0CAQYIKoZIzj0DAQcDQgAEVfynJz69w6dsXEdEki8s/ssg+MWBFhCOz/ziZPy6CFTyoCG5hUzJubntcXBT16IdAj4nEyTpZqlGqLql9YkvaaNFMEMwHQYDVR0OBBYEFK6N1v9Hj53fUQgw8ASiBTLbXrOqMBIGA1UdEwEB/wQIMAYBAf8CAQAwDgYDVR0PAQH/BAQDAgEGMAoGCCqGSM49BAMCA0kAMEYCIQDUbie9vDIDDGYrO24yc2dO2qika8NkjGhb540x9o6NXgIhAJ9RUu3utEy2/ZRo3KDR9koiTBGN8bRSnqwbq2Yy+BpY"
  ],
  "notBefore": "2026-10-19T11:55:00Z",
  "notAfter": "2026-10-26T12:00:00Z",
  "renewAfter": "2026-10-24T08:00:00Z"
}
